Q39,5QL,SOMERSET PCT,C_999,Total,29,0,6,2,4,4,7,2,4,0,0,0,0,0,0,0,0,0,0,0,0,0,0,0,0,0,0,0,0,0,0,0
Q39,5QM,DORSET PCT,C_999,Total,143,31,30,20,20,16,9,6,2,5,0,2,1,1,0,0,0,0,0,0,0,0,0,0,0,0,0,0,0,0,0,0
Q39,5QN,BOURNEMOUTH AND POOLE TEACHING PCT,C_999,Total,38,10,7,5,6,1,1,3,2,3,0,0,0,0,0,0,0,0,0,0,0,0,0,0,0,0,0,0,0,0,0,0
Q39,5QQ,DEVON PCT,C_999,Total,433,104,61,59,34,34,33,41,21,24,5,3,6,3,0,2,0,2,0,1,0,0,0,0,0,0,0,0,0,0,0,0
Q39,RA3,WESTON AREA HEALTH NHS TRUST,C_999,Total,1075,71,175,153,117,82,106,76,60,53,28,23,24,20,20,17,15,9,8,9,9,0,0,0,0,0,0,0,0,0,0,0
Q39,RA4,YEOVIL DISTRICT HOSPITAL NHS FOUNDATION TRUST,C_999,Total,2128,254,275,217,193,127,115,157,88,115,95,83,89,75,54,57,50,30,24,17,13,0,0,0,0,0,0,0,0,0,0,0
Q39,RA7,UNIVERSITY HOSPITALS BRISTOL NHS FOUNDATION TRUST,C_999,Total,6839,708,850,754,677,450,449,464,454,336,309,302,210,222,150,128,110,108,70,39,27,5,6,7,3,1,0,0,0,0,0,0
Q39,RA9,SOUTH DEVON HEALTHCARE NHS FOUNDATION TRUST,C_999,Total,1983,198,347,292,225,147,157,88,70,62,41,72,44,59,46,21,31,37,16,13,16,1,0,0,0,0,0,0,0,0,0,0
Q39,RBA,TAUNTON AND SOMERSET NHS FOUNDATION TRUST,C_999,Total,4778,371,443,468,423,335,288,342,283,231,233,229,237,180,164,136,125,123,85,33,47,0,1,1,0,0,0,0,0,0,0,0
Q39,RBB,ROYAL NATIONAL HOSPITAL FOR RHEUMATIC DISEASES NHS FOUNDATION TRUST,C_999,Total,92,51,22,9,2,4,2,1,1,0,0,0,0,0,0,0,0,0,0,0,0,0,0,0,0,0,0,0,0,0,0,0
Q39,RBD,DORSET COUNTY HOSPITAL NHS FOUNDATION TRUST,C_999,Total,3074,253,362,367,299,166,267,234,158,147,166,130,100,92,93,95,70,39,20,12,4,0,0,0,0,0,0,0,0,0,0,0
Q39,RBZ,NORTHERN DEVON HEALTHCARE NHS TRUST,C_999,Total,1421,327,266,168,152,107,113,71,43,42,24,29,24,14,12,9,9,4,2,2,3,0,0,0,0,0,0,0,0,0,0,0
Q39,RD1,ROYAL UNITED HOSPITAL BATH NHS TRUST,C_999,Total,3235,297,376,287,317,195,208,255,196,202,186,203,145,121,70,47,38,45,30,17,0,0,0,0,0,0,0,0,0,0,0,0
Q39,RD3,POOLE HOSPITAL NHS FOUNDATION TRUST,C_999,Total,1701,204,311,248,215,144,174,115,83,59,57,22,19,14,11,11,9,2,3,0,0,0,0,0,0,0,0,0,0,0,0,0
Q39,RDZ,THE ROYAL BOURNEMOUTH AND CHRISTCHURCH HOSPITALS NHS FOUNDATION TRUST,C_999,Total,3896,400,464,515,553,345,308,298,217,169,168,137,100,62,67,28,27,18,10,3,7,0,0,0,0,0,0,0,0,0,0,0
Q39,REF,ROYAL CORNWALL HOSPITALS NHS TRUST,C_999,Total,5490,586,671,598,590,303,397,302,259,272,254,186,207,155,170,150,113,92,81,44,60,0,0,0,0,0,0,0,0,0,0,0
Q39,RH8,ROYAL DEVON AND EXETER NHS FOUNDATION TRUST,C_999,Total,4801,764,573,509,489,336,429,322,257,215,205,172,143,113,68,79,44,35,20,18,4,4,0,2,0,0,0,0,0,0,0,0
Q39,RK9,PLYMOUTH HOSPITALS NHS TRUST,C_999,Total,5423,835,777,734,613,404,359,312,309,210,177,174,140,99,101,58,38,35,22,17,9,0,0,0,0,0,0,0,0,0,0,0
Q39,RN3,GREAT WESTERN HOSPITALS NHS FOUNDATION TRUST,C_999,Total,4390,265,357,342,411,247,354,264,294,313,273,296,242,197,146,149,119,66,34,11,10,0,0,0,0,0,0,0,0,0,0,0
Q39,RNZ,SALISBURY NHS FOUNDATION TRUST,C_999,Total,2805,254,380,237,324,253,210,193,145,138,120,110,73,85,71,52,51,36,35,28,10,0,0,0,0,0,0,0,0,0,0,0
Q39,RTE,GLOUCESTERSHIRE HOSPITALS NHS FOUNDATION TRUST,C_999,Total,6465,1013,975,879,724,487,443,376,349,241,193,140,144,147,102,109,62,45,18,9,9,0,0,0,0,0,0,0,0,0,0,0
Q39,RVJ,NORTH BRISTOL NHS TRUST,C_999,Total,5809,695,650,629,609,446,454,435,361,256,250,230,180,160,114,82,104,59,44,18,33,0,0,0,0,0,0,0,0,0,0,0
